{
  "$schema": "https://json-schema.org/draft/2020-12/schema",
  "$id": "https://live-comc-app/schemas/verdict.schema.json",
  "title": "verdict",
  "description": "파이프라인 ⑦ 안전 검증 게이트 출력. 규칙 기반(LLM 자기평가 아님). 근거 없는 문장을 버리고 최종 발화 텍스트를 확정.",
  "type": "object",
  "properties": {
    "pass": {
      "type": "boolean",
      "description": "전체 통과 여부. 하나라도 위반이 있으면 false지만 kept_sentences로 부분 발화는 가능"
    },
    "absence_by_closure": {
      "type": "array",
      "description": "인용이 아니라 화이트리스트가 닫힌 집합이라는 사실에 근거한 문장 인덱스 (M8). '없다'를 지지하는 인용은 존재할 수 없으므로 무엇으로 뒷받침됐는지를 구분해 남긴다.",
      "items": {
        "type": "integer"
      }
    },
    "final_text": {
      "type": "string",
      "description": "검증 후 남은 문장으로 조립한 최종 발화 텍스트 (⑧ overlay·⑨ TTS 공통 입력)"
    },
    "kept_sentences": {
      "type": "array",
      "items": {
        "type": "integer",
        "minimum": 0
      },
      "description": "근거 검증을 통과해 발화에 포함된 문장 인덱스"
    },
    "dropped_sentences": {
      "type": "array",
      "description": "검증 탈락 문장과 사유",
      "items": {
        "type": "object",
        "properties": {
          "sentence_idx": {
            "type": "integer",
            "minimum": 0
          },
          "reason": {
            "type": "string",
            "enum": [
              "no_evidence",
              "evidence_not_found",
              "coverage_violation",
              "length_hardcut",
              "fact_not_in_evidence",
              "absence_contradicts_coverage",
              "style_broken",
              "cross_part",
              "creative_policy",
              "source_disclosure_missing",
              "persona_policy"
            ],
            "description": "탈락 사유: claim 없음/근거 문자열 미발견/화이트리스트 위반/길이 하드컷 초과/숫자·고유명사가 자기 근거에 없음(M8)/화이트리스트에 있는 항목을 없다고 주장(M8) / style_broken: 방송에서 읽을 수 없는 종결(M10 규칙 8) / cross_part: 질문이 다른 파트를 가리켜 현재 파트 근거로 답할 수 없음(사고 10)"
          }
        },
        "required": [
          "sentence_idx",
          "reason"
        ],
        "additionalProperties": false
      }
    },
    "violations": {
      "type": "array",
      "description": "safety_policy 규칙 위반 기록 (rule_id 참조)",
      "items": {
        "type": "object",
        "properties": {
          "rule_id": {
            "type": "string",
            "description": "safety_policy.json의 규칙 ID"
          },
          "detail": {
            "type": "string"
          }
        },
        "required": [
          "rule_id"
        ],
        "additionalProperties": false
      }
    },
    "length_after": {
      "type": "integer",
      "minimum": 0,
      "description": "검증 후 최종 문장 수"
    },
    "verified_at": {
      "type": "string",
      "format": "date-time"
    }
  },
  "required": [
    "pass",
    "final_text",
    "kept_sentences",
    "dropped_sentences",
    "violations"
  ],
  "additionalProperties": false
}
