{
  "pass": false,
  "absence_by_closure": [],
  "final_text": "지난주에 만든 콘텐츠로는 총기난사 대처 요령 공익 영상과 Builders Lounge 5차 발표 영상을 소개했습니다. 오늘의 실험 파트에서는 나만의 일정 관리 앱 Personal Ops Board를 시작해 인덱서 점검에 들어가고, CoMC 테스트를 이어가며, Chrome Remote Desktop 정리와 영상 제작 계획을 다뤘습니다. 지금은 3부 학습 파트가 진행 중이에요 — Claude Artifacts & Routines 살펴보고 Seattle AI Week 준비를 연결하고 있습니다. 앞으로 남은 순서는 3부를 마무리한 뒤 아웃트로로 정리하고 방송을 닫는 흐름입니다. 잠깐 진행자가 자리를 비운 상태라, 돌아오면 이어서 같은 순서로 진행할 예정이에요.",
  "kept_sentences": [
    1,
    2,
    3,
    4,
    5
  ],
  "dropped_sentences": [
    {
      "sentence_idx": 0,
      "reason": "fact_not_in_evidence"
    }
  ],
  "violations": [
    {
      "rule_id": "claim.facts_must_be_quoted",
      "detail": "문장 0: 고유명사 'Catch'"
    }
  ],
  "length_after": 5,
  "verified_at": "2026-09-27T14:53:08.620429+00:00"
}
